{
    "search_gallery": "",
    "keyword_search": "",
    "categories": "",
    "good_will_location": "",
    "low_price": 0,
    "high_price": 999999,
    "show_buy_now_only": false,
    "show_pick_up_only": false,
    "hide_pick_up_only": false,
    "show_one_cent_ship_only": false,
    "search_description": true,
    "show_closed_auctions": false,
    "closed_auction_end_date": "11/14/2018",
    "day_back": 9,
    "search_canada": false,
    "search_international": false,
    "field_order": 0,
    "page_number": 0,
    "page_size": 40,
    "short_description": true,
    "saved_search_id": 0,
    "use_buyer_prefrences": true
}